,main_body_mid,main_body_uid,发布时间,处理内容,评论地点,mid,回复数量,点赞数量,原生内容,uid,用户昵称,用户主页,用户描述,用户地理位置,用户性别,用户粉丝数量,用户关注数量,用户全部微博,用户累计评论,用户累计转发,用户累计获赞,用户转评赞,用户认证信息
0,5154963274334512,1759015447,2025-04-16 14:59:34,这不是重男轻女导致的么？男女比例失衡！也更说明男性更想结婚！而女性并不想！你真的是律师吗？还是你只是想吃男女对立的红利？,来自广东,5156071796115955,2,0,这不是重男轻女导致的么？男女比例失衡！也更说明男性更想结婚！而女性并不想！你真的是律师吗？还是你只是想吃男女对立的红利？,7210066092,我说我叫马铃薯你非要叫我土豆,https://weibo.com/u/7210066092,````````````````````````````````,广东 惠州,f,8,328,84,82,6,332,420,
1,5154963274334512,1759015447,2025-04-13 13:43:34,支持！支持男的坚持不谈恋爱不结婚。,来自广东,5154965505183099,23,133,支持！支持男的坚持不谈恋爱不结婚。,1639055284,lyastark,https://weibo.com/u/1639055284,拒绝杠精和脑部发育不良者，会拉黑。,广东 广州,f,27,1052,4364,29,112,229,370,
2,5154963274334512,1759015447,2025-04-14 10:03:07,男人应该为了爱情零彩礼上门了，别那么拜金,来自海南,5155272415512379,8,46,男人应该为了爱情零彩礼上门了，别那么拜金,6623274254,YUANLAI-XU,https://weibo.com/u/6623274254,坚持公平正义,海南,f,119,939,5619,236,578,972,"1,786",
3,5154963274334512,1759015447,2025-04-13 13:37:22,"烟都戒不了，荷尔蒙能戒得了？<img alt=""[doge]"" title=""[doge]"" src=""https://face.t.sinajs.cn/t4/appstyle/expression/ext/normal/a1/2018new_doge02_org.png"" />",来自新疆,5154963950404293,5,17,烟都戒不了，荷尔蒙能戒得了？[doge],2528684350,kerrig,https://weibo.com/u/2528684350,,新疆,m,105,175,1169,17,1,106,124,
4,5154963274334512,1759015447,2025-04-16 09:29:12,这么看来，男人活该，支持捞女收割富人的钱包,来自浙江,5155988655573411,3,4,这么看来，男人活该，支持捞女收割富人的钱包,6747228524,絆嗰承諾,https://weibo.com/u/6747228524,得到即失去，孤独却不能回头。信念使我在茫茫人海不曾回头,浙江 台州,m,105,65,371,9,3,34,46,
5,5154963274334512,1759015447,2025-04-13 13:43:04,"确实如此，我有很多熟人都是搞了八年以上都被迫结婚的，他们从十多岁开始谈乱爱，几年后，被迫结婚。不过年龄大的没有这样的，一般过了二十岁的，就只能做梦了。<img alt=""[偷乐]"" title=""[偷乐]"" src=""https://face.t.sinajs.cn/t4/appstyle/expression/ext/normal/fa/lxhtouxiao_thumb.gif"" />",来自河北,5154965379614848,0,5,确实如此，我有很多熟人都是搞了八年以上都被迫结婚的，他们从十多岁开始谈乱爱，几年后，被迫结婚。不过年龄大的没有这样的，一般过了二十岁的，就只能做梦了。[偷乐],6608365226,前方路长怎能止步,https://weibo.com/u/6608365226,,河北,m,156,1893,1018,67,19,155,241,
6,5154963274334512,1759015447,2025-04-13 13:37:39,成都呢？,来自上海,5154964017780134,0,1,成都呢？,2476823680,史前的伊蚊,https://weibo.com/u/2476823680,玩微博嘛，无非两件事。一件是关我P事。另一件是关你P事。,上海 静安区,m,500,461,13580,"2,528","5,656","2,306","10,490",
7,5154963274334512,1759015447,2025-04-13 14:59:23,能找到老婆就不错了，饱汉不知饿汉饥,来自江苏,5154984584811525,3,0,能找到老婆就不错了，饱汉不知饿汉饥,2160546793,七九三十,https://weibo.com/u/2160546793,,其他,f,287,1112,1179,81,14,97,192,
8,5154963274334512,1759015447,2025-04-14 13:26:38,支持 我是女的 两性之间各过各的就好了,来自广东,5155323632160436,0,14,支持 我是女的 两性之间各过各的就好了,1289422375,喵小小小小小__,https://weibo.com/u/1289422375,I want sweet as sugar and everything nice!,北京 东城区,f,83,314,15,0,0,1,1,
9,5154963274334512,1759015447,2025-04-15 08:42:48,"<img alt=""[嘻嘻]"" title=""[嘻嘻]"" src=""https://face.t.sinajs.cn/t4/appstyle/expression/ext/normal/33/2018new_xixi_org.png"" /><img alt=""[二哈]"" title=""[二哈]"" src=""https://face.t.sinajs.cn/t4/appstyle/expression/ext/normal/22/2018new_erha_org.png"" /><img alt=""[并不简单]"" title=""[并不简单]"" src=""https://face.t.sinajs.cn/t4/appstyle/expression/ext/normal/aa/2018new_bingbujiandan_org.png"" />主要还是要传宗接代——有后的压力太大。<img alt=""[doge]"" title=""[doge]"" src=""https://face.t.sinajs.cn/t4/appstyle/expression/ext/normal/a1/2018new_doge02_org.png"" />然而现代科技还没制造出人工模拟子宫的环境来。<img alt=""[喵喵]"" title=""[喵喵]"" src=""https://face.t.sinajs.cn/t4/appstyle/expression/ext/normal/7b/2018new_miaomiao_org.png"" />",来自山东,5155614591552506,1,0,[嘻嘻][二哈][并不简单]主要还是要传宗接代——有后的压力太大。[doge]然而现代科技还没制造出人工模拟子宫的环境来。[喵喵],1648990441,任叔岳,https://weibo.com/u/1648990441,历史学半通的军迷军事爱好者一个，同时也喜欢文艺作品……但是对流行文化不感冒，颇有怀旧情怀！,山东 滨州,m,165788,12270,115013,"19,812","50,446","52,604","122,862",头条文章作者
10,5154963274334512,1759015447,2025-04-13 13:47:11,说的有道理，现在很多男士也开始觉醒了，今年情人节妇女节朋友圈可见一斑，没几个女生显摆礼物了,来自广东,5154966421111162,1,10,说的有道理，现在很多男士也开始觉醒了，今年情人节妇女节朋友圈可见一斑，没几个女生显摆礼物了,6225144289,用户6225144289,https://weibo.com/u/6225144289,谁无暴风劲雨时，守的云开见明月,广东 广州,m,42,363,27,2,0,33,35,
11,5154963274334512,1759015447,2025-04-13 13:55:57,"彩礼适当十万以内合理，超过十万或者漫天要价的基本不是真心过日子<img alt=""[允悲]"" title=""[允悲]"" src=""https://face.t.sinajs.cn/t4/appstyle/expression/ext/normal/83/2018new_kuxiao_org.png"" />",来自福建,5154968622597846,1,0,彩礼适当十万以内合理，超过十万或者漫天要价的基本不是真心过日子[允悲],7547202276,Mical0,https://weibo.com/u/7547202276,,其他,f,19,35,4,0,1,1,2,
12,5154963274334512,1759015447,2025-04-13 13:42:06,日本又领先我们20年了。,来自广东,5154965137393568,0,4,日本又领先我们20年了。,7732820538,crazy_牛牛_,https://weibo.com/u/7732820538,,其他,m,73,266,96,22,15,37,74,
13,5154963274334512,1759015447,2025-04-16 10:17:43,没办法，🐢男太多了,来自辽宁,5156000865192899,0,4,没办法，🐢男太多了,6356775879,懵懂小李在线摄影,https://weibo.com/u/6356775879,,其他,m,101,143,33,1,0,1,2,
14,5154963274334512,1759015447,2025-04-13 13:38:10,再多点婚姻诈骗，龟龟们要么被搞死要么觉醒,来自北京,5154964146226355,0,5,再多点婚姻诈骗，龟龟们要么被搞死要么觉醒,1777369455,马_不停蹄,https://weibo.com/u/1777369455,,北京,m,512,400,2600,"1,215",986,113,"2,314",
15,5154963274334512,1759015447,2025-04-13 19:19:59,不好说，但可以先为自己而活，丢一丢社会角色之类规训,来自北京,5155050168522356,0,2,不好说，但可以先为自己而活，丢一丢社会角色之类规训,3625640517,横风不摇,https://weibo.com/u/3625640517,,江西 南昌,m,105,470,1740,57,16,278,351,
16,5154963274334512,1759015447,2025-04-16 11:53:24,让男生团结起来，基本上不可能，没办法，社会就是这样，谁让女生比男生少呢？物以稀为贵呗，要是男少女多，你试试,来自甘肃,5156024948359702,0,1,让男生团结起来，基本上不可能，没办法，社会就是这样，谁让女生比男生少呢？物以稀为贵呗，要是男少女多，你试试,6443565187,巴黎夜雨80914,https://weibo.com/u/6443565187,答案都在路上，自由都在风里,其他,m,26,195,23,4,0,42,46,
17,5154963274334512,1759015447,2025-04-14 18:59:17,支持男人远离女人 不婚不谈恋爱不嫖娼 不要姐妹的房子财产,来自河南,5155407346538260,0,1,支持男人远离女人 不婚不谈恋爱不嫖娼 不要姐妹的房子财产,7910885495,7910885495_275,https://weibo.com/u/7910885495,新建文件夹/11bt性别分离主义者,河南,m,57,260,912,50,76,546,672,
18,5154963274334512,1759015447,2025-04-16 15:04:35,一定要说到做到啊，谁做不到谁是金针菇,来自湖北,5156073057813935,0,1,一定要说到做到啊，谁做不到谁是金针菇,6340530816,萤火虫HL531,https://weibo.com/u/6340530816,,湖北,f,212,1915,134,1,4,35,40,
19,5154963274334512,1759015447,2025-04-13 13:35:52,"女性也就在这个方面占有点优势<img alt=""[允悲]"" title=""[允悲]"" src=""https://face.t.sinajs.cn/t4/appstyle/expression/ext/normal/83/2018new_kuxiao_org.png"" />",来自山西,5154963568988072,1,1,女性也就在这个方面占有点优势[允悲],6256294329,老贾的山之子,https://weibo.com/u/6256294329,平遥国际电影展资深影迷，山西汾酒股份男篮普通球迷。,山西 太原,m,32,89,796,97,7,235,339,
20,5154963274334512,1759015447,2025-04-16 15:19:42,龟男太多，没用,来自湖南,5156076862571821,0,0,龟男太多，没用,6990621657,夏目爱大雄,https://weibo.com/u/6990621657,,北京,f,85,201,352,371,5,"1,893","2,269",
21,5154963274334512,1759015447,2025-04-16 14:58:03,要及时止损，女的不愿意，直接换下一个啊！除非两个柏拉图之恋啊！非得一上脑，把自己搞进去不值当！,来自山东,5156071418626448,0,0,要及时止损，女的不愿意，直接换下一个啊！除非两个柏拉图之恋啊！非得一上脑，把自己搞进去不值当！,2301362521,昱到枫的PZ,https://weibo.com/u/2301362521,,山东 济南,m,101,548,933,62,10,221,293,
22,5154963274334512,1759015447,2025-04-16 14:56:16,"倒是没必要不谈恋爱，准确的说是没必要不日逼。但是谈彩礼房产加名记得跑就完了。相亲波都没波过但是先给钱那种我是真不能理解。我看干脆一刀切，必须自由恋爱，相亲犯法。<img alt=""[允悲]"" title=""[允悲]"" src=""https://face.t.sinajs.cn/t4/appstyle/expression/ext/normal/83/2018new_kuxiao_org.png"" />",来自浙江,5156070965906120,0,0,倒是没必要不谈恋爱，准确的说是没必要不日逼。但是谈彩礼房产加名记得跑就完了。相亲波都没波过但是先给钱那种我是真不能理解。我看干脆一刀切，必须自由恋爱，相亲犯法。[允悲],7869179210,开心向前冲1008,https://weibo.com/u/7869179210,,其他,m,117,267,1,4,1,0,5,
23,5154963274334512,1759015447,2025-04-16 14:52:54,不太可能，添狗太多了,来自山东,5156070117084117,0,0,不太可能，添狗太多了,7362861039,空调的风一会冷一会热,https://weibo.com/u/7362861039,,北京,f,84,656,17056,81,40,470,591,
24,5154963274334512,1759015447,2025-04-16 13:47:28,男宝怎么不团结，生孩子随男方姓，户口上男方，过年回男方家过年，怎么能说男宝不团结呢,来自福建,5156053654438162,0,0,男宝怎么不团结，生孩子随男方姓，户口上男方，过年回男方家过年，怎么能说男宝不团结呢,6519309727,hehe123789456,https://weibo.com/u/6519309727,,黑龙江 哈尔滨,f,1,285,397,1,0,76,77,
25,5154963274334512,1759015447,2025-04-16 12:32:57,老师，您方当年给了彩礼了吗,来自内蒙古,5156034897775910,0,0,老师，您方当年给了彩礼了吗,6081142362,风间32,https://weibo.com/u/6081142362,,内蒙古,m,92,526,261,2,0,10,12,
26,5154963274334512,1759015447,2025-04-16 11:18:43,支持，别想舆论断案，你也配做律师,来自重庆,5156016216083102,0,0,支持，别想舆论断案，你也配做律师,7403089418,棠琯柚子,https://weibo.com/u/7403089418,,其他,m,96,115,263,100,26,"1,142","1,268",
27,5154963274334512,1759015447,2025-04-16 10:48:36,"没有组织的人类团结不现实。奉劝各位，1）找个真正对自己有兴趣的人，高彩礼说明对方觉得你配不上，需要经济补偿。2）感情会变，经济自己掌控。3）不要认为自己付出多别人会感动，男女都一样。总之理解人性，对自己好点，别怨天尤人。<img alt=""[思考]"" title=""[思考]"" src=""https://face.t.sinajs.cn/t4/appstyle/expression/ext/normal/30/2018new_sikao_org.png"" />",来自四川,5156008638024950,0,0,没有组织的人类团结不现实。奉劝各位，1）找个真正对自己有兴趣的人，高彩礼说明对方觉得你配不上，需要经济补偿。2）感情会变，经济自己掌控。3）不要认为自己付出多别人会感动，男女都一样。总之理解人性，对自己好点，别怨天尤人。[思考],7839947255,爱吃甜食熊爸爸2023,https://weibo.com/u/7839947255,,其他,m,49,102,259,19,2,188,209,
28,5154963274334512,1759015447,2025-04-14 17:11:23,"对对对，不过坚持三五年可不行，好歹得坚持一辈子<img alt=""[偷笑]"" title=""[偷笑]"" src=""https://face.t.sinajs.cn/t4/appstyle/expression/ext/normal/71/2018new_touxiao_org.png"" />千万不能让女人花我一分钱",来自上海,5155380196016417,1,0,对对对，不过坚持三五年可不行，好歹得坚持一辈子[偷笑]千万不能让女人花我一分钱,7980616751,用户已注销账户404,https://weibo.com/u/7980616751,,其他,m,28,40,0,0,0,0,0,
29,5154963274334512,1759015447,2025-04-13 18:16:58,是不团结的原因吗？是女权的过度保护，外加男女比例失调严重,来自河北,5155034308544326,0,0,是不团结的原因吗？是女权的过度保护，外加男女比例失调严重,7599286918,用户7599286918,https://weibo.com/u/7599286918,,其他,m,10,96,2,0,0,0,0,
30,5154963274334512,1759015447,2025-04-13 14:59:57,有这种态度的是好男人，是积极向上的人，愿意在家庭中主动承担责任。提这种要求的女性是贬低自己物化自己的。,来自湖南,5154984728462022,0,0,有这种态度的是好男人，是积极向上的人，愿意在家庭中主动承担责任。提这种要求的女性是贬低自己物化自己的。,7833613616,stardragon_prc,https://weibo.com/u/7833613616,,其他,m,49,153,1477,20,35,129,184,
31,5154963274334512,1759015447,2025-04-13 13:35:54,"做大头梦呢<img alt=""[允悲]"" title=""[允悲]"" src=""https://face.t.sinajs.cn/t4/appstyle/expression/ext/normal/83/2018new_kuxiao_org.png"" />",来自江苏,5154963575802056,0,0,做大头梦呢[允悲],6181999241,茉莉花时时开,https://weibo.com/u/6181999241,,其他,m,5,33,86,92,49,157,298,
32,5154963274334512,1759015447,2025-04-16 14:11:30,这是一个律师能说出来的话？大家随手举报吧,来自北京,5156059703410918,0,0,这是一个律师能说出来的话？大家随手举报吧,7992197517,用户7992197517,https://weibo.com/u/7992197517,,其他,m,1,7,23,1,0,0,1,
33,5154963274334512,1759015447,2025-04-13 14:30:16,你先看看耙耳朵血统有多少,来自新疆,5154977258409055,0,0,你先看看耙耳朵血统有多少,7972543527,老干妈夹馍馍,https://weibo.com/u/7972543527,爱猫单身狗,其他,m,225,541,144,66,4,86,156,
34,5154963274334512,1759015447,2025-04-14 12:09:49,当青年的时候不想给，当老丈人的时候又嫌弃给得少,来自广东,5155304299823913,0,3,当青年的时候不想给，当老丈人的时候又嫌弃给得少,1837208292,Metatron-chen,https://weibo.com/u/1837208292,Let,广东,m,94,364,402,83,9,23,115,
35,5154963274334512,1759015447,2025-04-16 13:58:24,"支持0彩礼，支持0陪嫁，支持谁生都孩子跟谁信，不，生什么孩子啊，有生育权的可以拒绝生孩子，支持男的入赘，支持入赘以后免费做家务还得无时无刻提供情绪价值，支持消费AA,这样更公平，男的不入赘，就男女共同在外找房",来自四川,5156056403281016,0,0,"支持0彩礼，支持0陪嫁，支持谁生都孩子跟谁信，不，生什么孩子啊，有生育权的可以拒绝生孩子，支持男的入赘，支持入赘以后免费做家务还得无时无刻提供情绪价值，支持消费AA,这样更公平，男的不入赘，就男女共同在外找房",7447570784,氡氡最美,https://weibo.com/u/7447570784,,湖南,f,4,123,464,192,0,538,730,
36,5154963274334512,1759015447,2025-04-16 11:24:44,年轻人硬起来和钢筋一样，你指望他们能受得住？,来自河北,5156017731011933,0,0,年轻人硬起来和钢筋一样，你指望他们能受得住？,7776180285,今天跑图了吗e,https://weibo.com/u/7776180285,,河北 石家庄,m,23,14,1,0,0,0,0,
37,5154963274334512,1759015447,2025-04-16 11:15:51,最后两行理念错误，你还是想结婚，那你还是软蛋随便捏,来自江苏,5156015495712347,0,0,最后两行理念错误，你还是想结婚，那你还是软蛋随便捏,7894866709,chaser1118,https://weibo.com/u/7894866709,我很礼貌,其他,m,26,10,3,0,0,0,0,
38,5154963274334512,1759015447,2025-04-15 17:08:21,担心什么，cao自己妈，生血脉相承的孩子，财产握在自己家手里，千万别让其他女人有机会哦,来自安徽,5155741816849295,0,0,担心什么，cao自己妈，生血脉相承的孩子，财产握在自己家手里，千万别让其他女人有机会哦,7872097536,小小虹ovo,https://weibo.com/u/7872097536,,安徽 马鞍山,f,2,20,54,20,0,174,194,
39,5154963274334512,1759015447,2025-04-13 23:41:57,00后10后再往后几代，我觉得会跟欧美一样。,来自浙江,5155116093017674,1,0,00后10后再往后几代，我觉得会跟欧美一样。,7933641428,西红柿的狂潮,https://weibo.com/u/7933641428,,浙江,m,2,101,36,0,0,0,0,
40,5154963274334512,1759015447,2025-04-16 12:38:23,因为女的有子宫，男的没有。,来自河北,5156036266428233,0,0,因为女的有子宫，男的没有。,7971245827,独立思考观天下,https://weibo.com/u/7971245827,00后新媒体运营总监,海外 其他,f,6,49,285,1,11,74,86,
41,5154963274334512,1759015447,2025-04-15 11:28:10,"抬高彩礼的明明是男方 什么时候自己口袋里掏多少钱自己不能定了<img alt=""[doge]"" title=""[doge]"" src=""https://face.t.sinajs.cn/t4/appstyle/expression/ext/normal/a1/2018new_doge02_org.png"" />",来自浙江,5155656206912066,0,0,抬高彩礼的明明是男方 什么时候自己口袋里掏多少钱自己不能定了[doge],7991826144,悠然糖炒栗子写诗,https://weibo.com/u/7991826144,,其他,m,44,42,0,0,0,0,0,
42,5154963274334512,1759015447,2025-04-14 10:36:04,我希望各位女性多关注这类男权博主的文章，多学学他们就对了，看看男人追寻什么，就知道利益在哪了。香火的委屈很多上门女人不理解，咱们也努力当香火吧,来自海南,5155280708701786,0,1,我希望各位女性多关注这类男权博主的文章，多学学他们就对了，看看男人追寻什么，就知道利益在哪了。香火的委屈很多上门女人不理解，咱们也努力当香火吧,6623274254,YUANLAI-XU,https://weibo.com/u/6623274254,坚持公平正义,海南,f,119,939,5619,236,578,972,"1,786",
43,5154963274334512,1759015447,2025-04-14 10:01:59,男人挺团结的，他们虽然说反彩礼，但他们绝对不会零彩礼上门，他们绝对不会嫁给穷女人。他们一边卖女儿姐妹收彩礼一边骂上门背黑锅的女人拜金，团结得很呢。女人就不一样了，有为了爱情嫁给无车无房无彩礼琼男人的，有被她爹卖了换彩礼的，她们上门背黑锅但就是学不会像男人那样，坚决不上门。,来自海南,5155272129777701,0,2,男人挺团结的，他们虽然说反彩礼，但他们绝对不会零彩礼上门，他们绝对不会嫁给穷女人。他们一边卖女儿姐妹收彩礼一边骂上门背黑锅的女人拜金，团结得很呢。女人就不一样了，有为了爱情嫁给无车无房无彩礼琼男人的，有被她爹卖了换彩礼的，她们上门背黑锅但就是学不会像男人那样，坚决不上门。,6623274254,YUANLAI-XU,https://weibo.com/u/6623274254,坚持公平正义,海南,f,119,939,5619,236,578,972,"1,786",
44,5154963274334512,1759015447,2025-04-14 09:22:47,男性被提要彩礼也是活该，是真溅！我说我们广东的彩礼就是意思一下几千到2-3万，男同事听了说你们那的女人这么不值钱！这不是溅是什么？广东大把人都是俩人一起赚钱买房子的！,来自广东,5155262265558914,0,0,男性被提要彩礼也是活该，是真溅！我说我们广东的彩礼就是意思一下几千到2-3万，男同事听了说你们那的女人这么不值钱！这不是溅是什么？广东大把人都是俩人一起赚钱买房子的！,3165074065,猫爱饭,https://weibo.com/u/3165074065,。。。。。。,广东 广州,f,192,189,231,774,97,87,958,
45,5154963274334512,1759015447,2025-04-13 15:27:50,博流量言论。嫁妆、彩礼，是基于女性千百年婚恋不自由、没继承权衍生的媒妁礼制（律法），现代社会把它解读为生育补偿或保障，是基于如今女性既要照顾家庭还要工作，生育严重影响其就业收入。说到社会财富分配制度，有的地区生女户还是不能新分田地和宅基地呢。重男轻女的家庭，不给女儿财产还要她养老,来自北京,5154991744746309,0,0,博流量言论。嫁妆、彩礼，是基于女性千百年婚恋不自由、没继承权衍生的媒妁礼制（律法），现代社会把它解读为生育补偿或保障，是基于如今女性既要照顾家庭还要工作，生育严重影响其就业收入。说到社会财富分配制度，有的地区生女户还是不能新分田地和宅基地呢。重男轻女的家庭，不给女儿财产还要她养老,1777112461,咋的了咋的了快让他们看看,https://weibo.com/u/1777112461,,新疆,m,100,450,5317,858,937,"1,915","3,710",
